filename,name,medium,location,artist,style,year,decade,text
./Images/t4.png,Chapel,Buildings,West of Great Court,"Richard Sheppard, Robson and Partners",Modernism,1966-67,1960s,"A Byzantine church in high modernist style, Richard Sheppard’s Chapel is one of the college’s architectural gems. The story of the chapel at (not of!) Churchill College is at this point well-rehearsed. Constructed in 1967, it sits on land far away from its initial, prominent Storey’s Way location which was so fiercely opposed by such founding fellows as Sir Francis Crick, co-discoverer of the structure of DNA. This earlier scheme — which saw the Chapel situated between the boiler house and the porter’s lodge, underwent numerous design changes, most of which looked very different from what was eventually built. One design featured barrel vaults which would have echoed those of the dining hall’s. <br> <br>

It was perhaps just as well that Sheppard, pushed by the change of location, conceived the wonderful structure we have instead. Its modest dimensions, its distinctive, squat silhouette, its earthy exterior brickwork, all conjure to mind the serene, humble grandeur of an early Christian edifice like the Byzantine-era Mausoleum of Galla Placidia (a royal tomb) in Ravenna. Structurally, the chapel nakedly evokes the byzantine cross-in-square plan (the earliest of truly Byzantine innovations in church architecture, the first examples of which were built in the 8th century) upon which it is based. Interior function, which in the symbolically-laden language of the church plan also represents a collective spiritual function, is bared in external form. The cross-shaped roof slices through the central square worship-space (in the technical language of church architecture: the <em>naos</em>) embedding itself above it. Meanwhile, an annex (the byzantine <em>narthex</em>) extrudes from the chapel’s northerly wall. Glass panel windows offer a view from the outside to the conventionally-located baptismal font within the <em>narthex</em> space. The most obvious innovation in the Church's exterior form is that of a sort of inversion of the traditional dome: the funnel-shaped pattern of the skylights on the chapel roof seem to invite light into the space. If the magnificent domes of major basilicas and baptisteries are meant to evoke the mystery of the cosmos, the skylights provide access to the thing itself. <br> <br>

This motif — this stripping-away of pretension with modernist material, laying bare the sacred material of traditional Church form — continues as one enters the space. The perforations punched out by the cross roof are paned by iridescent stained glass, beautifully designed by John Piper and made by Patrick Reyntiens. The light that filters through these and the skylights perfectly dramatises the chapel’s central volume, filtering onto the centrally-placed altar, highlighting the four slender concrete pillars which divide the space. The pillars intersect with a concrete grid which divides the timber-panelled roof into a three-by-three square: these intersections are echoed in the intersected form of the suspended cross above the altar. Indeed, the grid itself is echoed by the smaller three-by-three square created by the skylights in the center: lending the roof a fractal-like sense of recession — as if imitating the recession of the absent dome. <br> <br>

These materials laid bare — concrete, brick, wood — are wonderfully tactile and inviting to the senses: this is a church which seeks not to strike awe, but which seeks to invite the visitor to exist as part of it, to interact with it. Gone is the traditional Byzantine apse, with its hieratic, raised <em>bema</em> (where the clergy and Holy Table would have been placed). There remains a slight recession in the wall where the <em>bema</em> would have been, but this makes space for the organ. The <em>narthex</em> — home of the unbaptised, the uninitiated (the <em>narthex</em> is where these would have stood in a Byzantine church) — remains, and retains its crucial, traditional symbolic role as a portal to the world outside the church. Punched out of the wall, the square created by the narthex extends the central grid into the surrounding landscape and becomes, as a result, the foot of the embedded cross of the floor plan, its glass panels opening up a view to the outside.
"
./Images/t5.png,Archives Centre,Buildings,Great Court,"Richard Sheppard, Robson and Partners",Modernism,1971-73,1970s,"The Archives Centre, opened in 1973, was built to house the papers of Winston Churchill. Its powerful verticals, continuing those which front the Bracken Library and unifying the building’s eastern elevation, lend it a magisterial presence. These soaring concrete mullions (echoing those found on the dining hall windows) convey a sense of security while also echoing the ordered rows of shelves — library and archival — within the building. There is something classical about the building's proportions, frightfully symmetrical, ceremonially raised on a concrete plinth. A beautifully-shaped, gracefully forbidding door, created by the sculptor Geoffrey Clarke, who also designed the gate outside the porter’s lodge, completes the design. The prominent position and commanding presence of the Archive in the great court — unusual for a Cambridge college — is fitting in a college which was always meant to serve as ‘a bridge between the achievements of the past and the possibilities of the future’."
./Images/t6.png,Pavilion,Buildings,West of Great Court,"Richard Sheppard, Robson and Partners",Modernism,1966-67,1960s,"Completed in 1967, the Churchill Sports Pavilion was one of the last buildings on the original site to open its doors to students. It was the place where parties and events were held until its reconfiguration in the 1990s, and was affectionately known among students as the ‘Pav’. <br> <br>

A notice circulated in October 1967 states succinctly that the building had been ‘designed both as a Pavilion and also as a place where parties can be held’. This description is actually rather idiosyncratic, because modern sports pavilions had — for many decades since the Great War — sought to incorporate facilities for social gatherings alongside sporting and washing facilities. The taxonomy and evolutionary history of the humble British sports pavilion as a building type — and its role in the story of modernism in British school architecture — is a fascinating story that has yet to be written. See, for example, Pembroke College’s sports pavilion on Grantchester Road,  built in 1939 and extended in the 1980s, which echoes the international style of architectural modernism. Richard Sheppard’s pavilion grapples with the same problems of spatial arrangement as all sports pavilion buildings of this type, which result from the interplay between small, segregated, private areas (changing and washing rooms) and large, open, social spaces which also demand a view of the sports grounds that the pavilion services. An early sketch from 1962 saw Sheppard considering a more conventional layout — with entrances to changing rooms directly facing out to the fields, in the same direction as the entrance to a much smaller club room. By 1966, however, Sheppard had begun to embrace the more Miesian implications of what the word 'pavilion' suggested. Sheppard didn't open the building up all the way, certainly not to the extent of Mies Van der Rohe's Barcelona Pavilion or Neue Nationalgalerie, but he did enough to open up nearly the whole facade with windows in a manner which suggested glass curtains. <br> <br>

This rearrangement was prompted as much by several changes to the layout demanded by the college owing to the budget (the removal of gyms, for example), as by the way modern materials could meet the simple demands of the building type. What would be more natural — if the entire facade could be opened up by glass in this way — than to push the private changing and washing rooms deeper into the building (accessed now from the east side of the building), pushing the open areas right to the front? There would now be a club room in the west half and a games room on the east — both allowing daytime users an attractive view to the sports fields. The only concern, now, was noise levels: there were worries that ‘the amplified cacophony that seems essential to a party’, as Sheppard put it, might not be adequately contained by glass, and there seems to have been some pressure to wall up the facade to mitigate against this. To settle the question, a fifteen-piece orchestra was brought into the building to test the noise-dampening properties of the material. Thankfully, the glass was deemed effective enough, and with the addition of curtains, the college and the architects were satisfied that parties could go on without disturbing the occupants of the nearby North Court. <br> <br>

The Pavilion seems to have been a successful design: apart from parties and discos — table tennis tournaments, karate sessions, conferences, and even weddings took place in this space, which was extended in 1979 with new music room facilities, and then almost completely refitted in 1993 as part of David Thurlow's Study Centre project. Today, Sheppard’s somewhat bulky grid of softwood-framed windows in front of the west-half Club room has been replaced by sleeker metal-framed ones; the club room has been converted to a gymnasium. As a result, it is today perhaps too easily ignored: though it is certainly far from one of the most aesthetically successful the original buildings on the site, having been built under a tighter budget, the glass-fronted Pav is still of great architectural interest for how the unique demands of the sports pavilion building type impelled Sheppard to modify the more solid, monumental idiom he had developed for the other College buildings.
"
./Images/t7.png,Music Rooms,Buildings,West of Great Court,"Richard Sheppard, Robson and Partners",Retrofit,1979-80,1970s,"In 1979, Sheppard, Robson and Partners was commissioned to design a single-storey extension to the existing sports pavilion (then affectionately known among college members as the ‘Pav’), which was to contain musical facilities. In 1980, the newly-constructed extension was inaugurated by Lady Mary Soames — the youngest of Sir Winston Churchill’s children. It is a utilitarian, unpretentious plan. A 100 metre square recital room took centre stage, flanked by three smaller practice rooms and storage areas. The recital room was supplied with ample natural light through full height sliding windows, with a view into the walled garden courtyard to the north. This general idea, in fact, has been preserved in the current Music Centre. This building would be the last in the college designed by Richard Sheppard’s firm — the college’s original architects. Though it would later be swallowed up by future additions to the site, the decision to extend the sports pavilion set the stage for future expansions in this area: David Thurlow’s Study Centre in 1993, and the New Study & Music Centre in designed by DSDHA (Deborah Saunt and David Hills Architects) 2007 which replaced it. The result is what Professor Mark Goldie, in his <em>Churchill College Cambridge: The Guide</em>, quite rightly calls a ‘palimpsest’ of architecture, progressively enlarged over the four decades between 1967 and 2007 by three different architects. This cross-temporal architectural mishmash is surely among the most unusual and fascinating architectural features of the site. Today, the original music centre has been converted into office space and training rooms for the Study Centre. It seems fitting that Richard Sheppard’s final contribution to Churchill College, intentionally or not, was taken as an invitation to future architects to join in."
./Images/t8.png,Study Centre,Buildings,West of Great Court,"David Thurlow, Carnell and Thornburrow",Retrofit,1992-93,1990s,"This creative extension and reimagining of Richard Sheppard’s original sports pavilion was college consultant architect David Thurlow’s economical response to a confluence of building needs. There was a desire to upgrade the college’s existing music rooms, built in 1979 as an extension at the back of the pavilion, to improve their acoustics and sound insulation. More pressingly, there was a need to supplement the teaching facilities in the newly-built Møller Centre, particularly a need to build larger classrooms. Furthermore, there were concerns about the appearance of the existing pavilion. Then-Bursar Michel Allen, for instance, was not a fan: he thought the existing pavilion sat uncomfortably between the Møller Centre and the college. Neither was the Centre’s architect, Henning Larsen, who in an early draft plan even suggested demolishing it and replacing it with a pavilion of his own design. <br> <br>

Thurlow’s response was to combine these needs by extending the pavilion east to create new study spaces, threading a spine through the complex to connect the new and old buildings, refurbishing the music rooms and reworking the facade of the pavilion to create a single, multi-purpose building. It was a clean, economical solution — much more so than his original, tentative proposal to demolish the pavilion and replace it with a completely new set of buildings. There is a pleasing, almost offbeat rhythm to Thurlow's new facade, a more lightweight feel that Sheppard’s original lacked, which helps it to mediate between the earthy, rectilinear solidity of the original college buildings and the Danish airiness of Larsen’s Møller Centre.  <br> <br>

The building itself pulls off postmodern playfulness even more successfully than its neighbour: idiosyncratic moments such as the single circular window on its western elevation (a reference, perhaps to the circular cutouts of the Møller Centre?), the almost comically elongated glass gable roof (which still stands out in a sea of modernist flat roofs), the incorporation of older buildings — this is playful architecture. The spinal lobby — an extension of the west-facing brise-soleil, suggests a bridging of the interior and exterior of the building, a sense heightened by the use of glass roofing over this lobby and the use of wood: plywood supported on Glulam wood beams: it is an interior which breathes the air outside. 
"
./Images/t9.png,AC Extension,Buildings,Great Court,"David Thurlow, Carnell, and Curtis",Retrofit,2001-2002,2000s,"Designed by Thurlow, Carnell, and Thornburrow, and opened in 2002, the extension of the Archives Centre was spurred by the arrival of the papers of Margaret Thatcher, who spearheaded the funding appeal for the building. Four storeys high and built to exacting specifications, the new wing of the Archives Centre features a prominent inscription, bearing names of donors and a quotation from a speech given by Churchill in July 1938 at Bristol University: ‘‘The inheritance bequeathed to us by former wise or valiant men becomes a rich estate to be enjoyed and used by all’."
./Images/t10.png,New Study & Music Centre,Buildings,West of Great Court,DSDHA (Deborah Saunt and David Hills),Retrofit,2006-2007,2000s,"The latest addition to the complex that has bubbled up around the nucleation point of Sheppard's original Churchill Sports Pavilion is an extension to the Study Centre, incorporating new music rooms, designed by DSDHA (Deborah Saunt and David Hills). Two main architectural objectives drove its design. Firstly — that the building should not impose itself forcefully upon the eye. The expansion of the building complex to the very border of Churchill Road, squeezing passers-by against the fences of the Storey’s Way properties to the North, would have threatened to create an architectural bottleneck along this already somewhat-cramped axis. Was there a way to maximise the building's area while maintaining Churchill’s guiding architectural principles: that of spatial openness and its sense of volume? Secondly — it was decided that the building’s structure itself should not obstruct the view of its inhabitants to the greenery outside. The building’s interior itself should incorporate a sense of the world outside.  <br> <br>

DSDHA’s RIBA-award-winning solution was surprisingly simple, and also something of an architectural anomaly for the college: a sleek, sci-fi glass box set upon a steel and timber-lined frame. The dark, semi-reflective glass cladding was deliberately chosen to provide privacy for the building’s inhabitants while at the same time reflecting the greenery planted along Churchill Road, resulting in a building that almost self-effaces. By incorporating an interior garden, a frame lined with timber shutters, corner windows, and large, open-plan spaces, featuring views through the glass-curtain cladding, the materiality of the spaces outside the building is brought indoors. Interestingly, an unobstructed view to a now-removed Henry Moore sculpture was also considered in the original plan.  <br> <br>

For all its architectural differences, there is one feature which gestures towards the original college buildings. The New Study & Music Centre sits on a concrete plinth, just as the original courts do. There is a sense of continuity here; of something new emerging from shared foundations. The roof was also originally meant to be copper-lined, like the original courts, which would have created a common visual frame further unifying two very different approaches to materiality. At the same time, DSDHA’s glass structure seems like the natural culmination of what Richard Sheppard had started with his original pavilion design, which itself gestured towards Miesian glass curtains, with its softwood-framed window-grid facade. 
"
./Images/t11.png,Cowan Court,Buildings,West of Great Court,6a Architects,Brutalism,2016,2010s,"Cowan Court, designed by the practice 6a Architects, is the college’s newest undergraduate residential court — the only one built on the main site since West Court in 1968. Built to the exact same external dimensions as the old residential courts, the building blends in seamlessly into the college landscape, as if it had always been meant to be there. Indeed, integration into the natural landscape was a key priority for the project: aesthetically and ecologically. Built to the standards of modern sustainable construction standards, the court is designed to minimise resource consumption. This aim extends even to the design of drainage, which directs rainwater into underground storage tanks, to be used later for irrigation. The focus on ecology is also embedded in the very material of the court: the external cladding is of oak salvaged from the floors of French freight trains. The approach is very new, but the oak is very old: and it is this knowing marriage of the extremely forward-looking and extremely backward-looking which makes the court (indeed, one might say, Churchill College as an institution) so unique. Even the jettying of the building’s layers: the slight protrusion of each storey over the one below, is a conscious architectural reference to the 16th Century Paycocke house, a fine example of Tudor timber construction. The interlocking wooden beams which provide structural support on the ground floor courtyard repeat a motif that recurs throughout the college architecture. They recall similarly interlocking concrete beams (such as those which support the covered walkways) which themselves recall timber construction: another one of Sheppard Robson’s ways of softening the Brutalist idiom. There is one key way in which Cowan Court differs from the rest of the main site, though — the slight curvature of the walls. They reflect, as Tom Emerson, the founder of 6a Architects put it, ‘a kind of receiving of the open landscape’. It may very well be, as Emerson suggests, the first fully ‘timber brutalist’ building in the UK.
"
./Images/t12.png,Chimney,Buildings,Great Court,"Richard Sheppard, Robson and Partners",Brutalism,1960-68,1960s,"The concrete chimney of the boiler house, a delightful piece of industrial design, overpeers the college’s silhouette. Churchill at its most nakedly Brutalist, the chimney embodies several architectural contradictions. Its undulant, double-barrelled form sticks out in the midst of the college’s boxy scheme, echoed only in the grand barrel vaults of the dining hall. Nonetheless the affect of its material and scale — heavy, <em>breton brut</em> concrete stacks — fortifies its softened forms, where brick, wood panelling, and shuttered concrete softens the rest of the site’s heavy-set modernist idiom. It is a religiously secular feature: Richard Sheppard’s original plans included a chapel prominently facing Storey’s Way, placed between the Porter’s Lodge and the boiler house. This scheme was famously vetoed by some of the college’s founding fellows, including Sir Francis Crick, one of the discoverers of the structure of DNA. (In an amusing letter to Sir Winston Churchill, in which he also submitted his resignation out of protest of the Chapel, he suggested that it would be just as well to build a brothel as a chapel in a purportedly secular, scientific college).  <br> <br>

Had it gone through, Sheppard’s model suggests the way that Crick’s secular indignation might have found architectural expression anyway. Towering over the chapel would have been the chimney: an industrial spire embodying hopes that, as a new, scientific institution, Churchill would represent a resurgent, postwar industrial Britain. It was no mere symbol anyway — the boiler house the chimney was attached to drove the University’s first central heating system, sporting cutting-edge jet fans tested in a wind tunnel in Harwell’s Atomic Energy Research Establishment (itself set up by the college’s first master: Sir John Cockroft). It has been said that in the notoriously freezing winter of 1963, Churchill undergraduates were the warmest ones in the University.
"
./Images/t13.png,Library Tower,Buildings,Great Court,"Richard Sheppard, Robson and Partners",Brutalism,1960-68,1960s,"Housing the staircase which connects the college’s two libraries, this is the only curved wall on the original main site. Besides the geometry of the residential courtyards, which famously echo the quadrangular monastic courts of the city’s older colleges, this semicircular tower is another one of Churchill’s self-conscious architectural medievalisms. Its force and monumentality enhanced by the rhymes of the adjacent Archive Center’s soaring vertical mullions, brickwork lending its texture a certain earthy solidity, the structure evokes the grandeur of a medieval fortress’s corner tower. The effect is no less pronounced as one ascends the staircase from the inside, where a skylight illuminates a strangely mesmerising spatial curvature. If modernist and brutalist architecture in the wake of Le Corbusier looked to the solidity of classical forms for inspiration, Churchill’s embrace of gothic forms in the same idiom chimes with his scheme’s overall ‘softening’ of brutalism’s stark edge with a craftsmanlike rationality. 
"
./Images/t14.png,Sheltered Walkway,Buildings,Great Court,"Richard Sheppard, Robson and Partners",Brutalism,1960-68,1960s,"Sure — the covered walkways are not perfect. They are narrow; there are leaks; not all the concrete is in the best of health. Nonetheless there is a sense of play in their construction that captures the imagination, compensating for the starkness of their material treatment. Despite Churchill College’s reputation for being a prime example of ‘brutalist’ architecture, the walkways are perhaps the only extensive sections of the building in which naked concrete — not shuttered, like much of the concrete highlights on interiors — is given free reign. Nonetheless, the joinery and regular horizontal furrows give one the impression of a timber structure. The joinings are satisfyingly articulated: evoking the manual craftsmanship of a carpenter. Richard Sheppard’s assistant, William Mullins, was responsible for most of the detailed design work in the college while Sheppard drew up larger plans. Here in the sheltered walkway, as in many other examples of joinery in the college, Mullins has found a way to be ornamental without sacrificing a functionalist aesthetic. Moments like these — small, perhaps obvious, but not insignificant delights — bring the college architecture to life."
