filename,name,medium,location,artist,style,year,decade,text
./Images/t15.png,Study Centre Proposal,Buildings,West of Great Court,David Thurlow,Postmodernism,1992,1990s,"These early concept drawings for the Study Centre project were drawn up by the college’s then-consultant architect David Thurlow. More the result of him ‘playing with his pencil’ than a final proposal, they ambitiously envisioned a reshaping of the site itself. Thurlow's project proposal arose from a confluence of building needs. There was a desire to upgrade the college’s existing music rooms, built in 1979 as an extension at the back of the pavilion, to improve their acoustics and sound insulation. More pressingly, there was a need to supplement the teaching facilities in the then newly-built Møller Centre, particularly a need to build larger classrooms. Furthermore, there were concerns about the appearance of the existing pavilion. Then-Bursar Michel Allen, for instance, was not a fan: he thought it sat uncomfortably between the Møller Centre and the college. <br> <br>

In this plan, Richard Sheppard’s original pavilion/music room complex was to be demolished; in its place were to be parking spaces and a cycle store, screened off by generous planting. Thurlow's new music room and study complex would edge away from the Møller Centre. The sporting facilities of the old pavilion would be shifted to a new pavilion to the south — roughly on the site where Cowan Court now sits. If built, these would have been strikingly original interventions in the college landscape. The undulant curved roof of the study centre, its spindly lattice facade, the circular ‘porthole’ windows, were all insistent elements of Thurlow’s personal architectural vocabulary, previously seen in his acclaimed work spearheading the Cambridge Design Group, partly inspired by Chinese architecture. See, for example, the delightfully irreverent Queensway down Trumpington Road. Together with the new pavilion, the new complex would have carved out a space, with planting blocking the westward view from the Great Court, defined by curvature. Thurlow would have created what would have almost been a rival ‘great court’ dominated by a 90s postmodern style, deliberately butting up against the square-set 60s modernism of Richard Sheppard’s original buildings. Though this scheme was replaced by the more economical alternative we have today, some cameos from this proposal would find their way into Thurlow’s final design: the porthole window, the lovely latticed glass roof of the spinal lobby, the lightness of a wooden frame.
"
./Images/t16.png,Night Suite,Prints,Main concourse,Robyn Denny,Abstraction,1972,1970s,"Robyn Denny (1930 - 2014) was one of the most significant British painters of the 1960s. Like many of his colleagues, Denny was immensely influenced by the wave of American abstract expressionism, which had arrived on British shores with the Tate’s 1956 ‘Modern Art in the USA’ exhibition. After some initial experiments with collage work and Rothko-style colour field painting, Denny quickly developed a style which abandoned all levels of reference to the outside world, almost all suggestion of painterly gesture, built out of flat, solid and symmetrical regions of colour. Again, like many of his fellow artists working with abstract expressionist ideas, Denny exhibited in the 1961 ‘Situation’ exhibition, alongside Richard Smith, William Turnbull and John Hoyland (some of whose works are also in the college’s collection). Denny, in fact, was the exhibition’s organising secretary. <br> <br>

What Denny chiefly took away from the new American painting — especially from Jackson Pollock — was a way of suggesting and thus incorporating the body into his painting through a sense of scale. Denny’s paintings in the 60s were stood on the floor of the gallery, their dimensions comfortably fitting that of a human form. It was partly for this reason that many critics spoke of these paintings in the language of architecture: as doorways, portals, entrances. Their rectilinear, symmetrical patterns may evoke architectural plans, but they also gesture to a certain space-age, science-fiction aesthetic. Denny was an avid reader of science fiction — the title of one of his more well-known early ‘Situation’ era paintings, <em>Baby is Three</em>(triptych, 1960), is taken from a sci-fi novella of the same name by Theodore Sturgeon. Not only, then, was Denny interested in working out the implications of visual art in present-day urban architecture — as his public mural art further testifies to — but his paintings also presciently suggest the forces which would, in a digital future, push communal space itself further into abstraction. Already in 1971 the critic David Thompson, in the first monograph written on Denny, detected Denny’s ‘conditioning by the spread of mass media, the workings of communications systems and information-theory’. <br> <br>

Denny saw great critical success and enjoyed not-insignificant fame during the 60s, during which he continued to refine this basic visual idiom. He became increasingly interested in the potential for his method to illuminate new ways of working with colour, later stating of his work in this period: ‘[a]t this time, I was experimenting with what new sensations of colour can be achieved with the most limited means — what great diversity of formal experience I could make with very limited forms.’ Thompson wrote of Denny’s colouring that ‘it requires to be seen (one could almost say ""watched"") by natural light … light which changes according to the time of day… The paintings are colour-structures which change as the light changes’. It is perhaps fitting, then, that Denny’s 1972 <em>Night Suite</em>, a series of five prints which are characteristic work from near the very end of this period of his career, has been hung facing the glass of the main concourse of Churchill College, illuminated by natural light. Their positioning in a space through which visitors pass — between the Porter’s Lodge and the main foyer of the college — resonates with their formally medial quality as they invite the viewer to engage bodily with their colour-structures. Their initial appearance of visual symmetry is broken by the asymmetry of the colouring and interlacing of the surface: subtle variations of shade and composition across left and right halves fix the attention as viewers might trace how colour-structure simultaneously undermines and undergirds the work’s formal symmetry. The interlace of this tapestry of colours is woven across each print as well — the central, progressively contracting rectangular field of each takes its colour from the ‘underpainting’ (if underpainting it can be called) of another print in the series. <br> <br>

Presciently, Denny’s paintings and prints from this era find a way of completely sidestepping the question of pictorial depth: confrontational but inviting, Denny’s colour-structures are a way of involving the viewer’s body into a dimension of pure flow. It is, nonetheless, a dimension much more wedded to surface than corporeality: truly the stuff of science fiction. The year after these prints were made, in 1973, Denny would become the youngest living artist given a retrospective in the Tate. This marked the apex of his critical fortunes — it was almost as if institutional sanction had blunted the edge of his work. Denny slipped into obscurity in the following decades — though he continued to produce paintings in a style which increasingly returned to painterly gesture, which turned increasingly to an idiom centred around moments rather than flows. It is true that his 60s idiom was at risk of becoming increasingly fussy, mannered, aestheticist: by the mid 1970s Denny was ready to move in a new direction. It is perhaps the college’s fortune to own this series of prints — from this inflection-point at which Denny had stretched the language of his 60s painting to its near-limit — which so wonderfully converse with the the flows of public space, all set within the architectural modernism of a technological college dedicated to turning science fiction into reality."
./Images/t17.png,Foundation Stone,Sculpture,Buttery,Edward Wright,Brutalism,1961,1960s,"The college’s foundation stone was designed by the graphic designer and typographer Edward Wright — also known for his typographical work on New Scotland Yard’s rotating sign. The muscular typeface of the stone's raised lettering was designed specifically for the occassion. It is unimposingly placed — albeit in the college’s main foyer; the most public of the college’s spaces. Cast in concrete: the choice of material for the foundation stone spoke to the college’s commitment to architectural modernism, for which concrete was, and still is, a sacred material. To call this handsome piece of cast concrete a stone (which has been shuttered like that of the rest of the building) is to recall Richard Sheppard’s vision for the college’s treatment of this material, outlined in a report on the design objectives for the College written in 1958: <br> <br> <em>‘Concrete, reinforced or not, is the most characteristic permanent material of our time and it is our proposal that Churchill should be constructed of concrete designed and detailed to exploit its qualities rather than to hide them. We do not mean by this that coarseness should be accepted but that the material should be regarded much in the way that stone has been in the past — good for building with but which can be much improved in appearance by application of appropriate working’.</em>"
./Images/t18.png,Blue Lion,Paintings,Porter's Lodge,Albert Irvin,Abstraction,2008,2000s,"Albert Irvin (1922-2015) was one of the most prominent British abstract expressionist painters. He developed an interest in art at a young age and pursued formal training at the Northampton School of Art from 1940 to 1941. His studies were interrupted by World War II, during which he served as a navigator in the Royal Air Force. After the war, he resumed his education at Goldsmiths College, London, graduating in 1950.

<em>Blue Lion</em> is considered to be one of his later works, and it can be said that its articulation differs immensely from that of his earlier style. While bursts of energy are still present in this work, Blue Lion takes on a more playful approach to the overall brushwork as compared to, say, <em> Tarbard </em> — another of Irvin's works on display in the College, along the corridor outside of the SCR. The bottom layers of the painting are generated through powerful linework in light blue paint, creating an extension radiating from the centre, extending  out beyond the canvas itself. Meanwhile on the topmost layer, consistent, smooth, brushstrokes abstracts the shape of a blue lion with mouth wide open. Unlike conventional depictions of a lion, the canvas's shapes and pictorial elements enhance the articulation of colour, alluding to the form of a lion. Angled squares suggest eyes, a splash of pink a nose, and various interlacing strokes at the centre of the canvas forms the mouth of the lion. <br> <br>

Overall, <em>Blue Lion</em> creates a captivating, evocative realm that pleads for attention, luring the viewer into the depths of colour, enticing those who stop before it. The blue background generates a seemingly infinite spatial depth, and every stroke added on top forms a floating pictorial element, creating links between the canvas's abstract shapes. The red and orange paint creates a focus point for the viewer navigating around the work, adding a playful touch to the blue dynamic that fills the canvas. It is a mysterious, alluring, yet lighthearted work."
./Images/t19.png,Bust of Ingres,Sculpture,Fellow's Dining Room,Antoine Bourdelle,Bust,1907,1900s,"This handsome bust of Jean-Auguste-Dominique Ingres, the great French neoclassical painter, entered the college through the donation of the Maisonneuve Collection. It is to date the largest donation of art to the college; comprising mostly of early 20th-century French art. This fierce, romantic bust, in its rough and robust sculptural finish, reflects the influence of Rodin, under whom its sculptor Antoine Bourdelle — himself an important figure in French sculpture — had studied. One other cast of this bust is in the collections of the Musée Bourdelle, in Paris; another in the Musée Ingres-Bourdelle in Montauban, the town in the South of France where both men were born. <br> <br>

The statue is unique in the Churchill College collection — one of the few figurative sculptures on display (albeit in the Fellows’ Dining Hall); certainly the only one of a person not directly connected to the college. Nonetheless, Just like the Lurçat Tapestry that hangs in the Bracken Library, which was famously presented to the college as a gift from General Charles De Gaulle to Sir Winston Churchill, it is a welcome reminder of the wartime link between Britain’s French allies and the man to whose memory the college is dedicated."
./Images/t20.png,13.12.66,Paintings,Fellow's Dining Room,John Hoyland,Abstraction,1966,1960s,"Like many of his fellow British artists working during the 1960s, John Hoyland (1934-2011) was immensely influenced by the wave of New American Painting which had arrived in the UK with the ‘Modern Art in the USA’ exhibition held at the Tate in 1956. There, Hoyland saw in person canvases by Pollock, Newman and — most importantly — Rothko. Hoyland, a Yorkshireman, would later become one of the most prominent British artists working in the abstract expressionist idiom, celebrated as a painter who succeeded in lending a distinctly European, even British touch to this most American of modern art movements. <br> <br>

Rothko’s influence is on full display in this painting, which today hangs in the Fellow’s Dining Hall, which was executed during a crucial, though relatively early period of Hoyland’s career. This was a period in which Hoyland was coming to terms with old influences, absorbing new ones, and beginning to synthesise them into a completely personal language. He had already gained some artistic prominence, having had his works exhibited in the two famous ‘Situation’ exhibitions in 1960 and 1961, which brought the best and most promising of modern British artists to the fore. At the second of these exhibitions, Hoyland exhibited alongside British sculptor Anthony Caro, who was to become a major influence. Hoyland would later recall that in the mid-Sixties, he was attempting to paint in a way ‘suggestive of sculpture…more about imagined form, imagined conceptualised space’. <br> <br>

Indeed, Hoyland’s sculptural intuition was what allowed him to absorb the influence of Rothko’s colour fields while finding his own way to develop the idiom. In Hoyland’s own words, he concerned himself with ‘the ways edges met, how colours impinged upon one another, and the way that that affected the space’. In <em>13.12.66</em>, Hoyland’s painterly treatment, the thin layering of acrylic in such a way that the canvas surface and brushstrokes remain visible, combine with the richness of his colouring — luscious, pool-table green, plum, blaring orange — to work with a Rothko-like directness on the senses, provoking an emotional experience which seems totally contained within the artwork's field. Nonetheless, sentiment (Rothko’s canvases are infamous for provoking attacks of weeping) is at every moment tempered by a sense of discipline, a certain wry structural logic. The red-orange rectangle on the right appears to project itself into the viewer’s space. An effect which is enhanced by its detachment from the other colour blocks, this ‘popping out’ of the red rectangle from the contrasting surrounding green field recalls the optical trickery of Hoyland’s earlier work, but declines to problematise this optical effect. The alignment of this colour block with the others, height-wise, tempers any disorienting effects anyway. <br> <br>

The diagonal which joins the edges of the trapezoidal blue and dark green forms in the left third of the canvas is also a motif that had begun to appear in this period. In this case, it suggests but does not insist upon depth, perspective and shadow. The blue trapezoidal form could just as well have been a strip ‘peeled back’ from the lower left corner — the very possibility of this interpretation in itself imbues the work with a certain wit. In any case, the green gap between the purple and red blocks; the tentative, feathery ways in which the edges of the blocks have been articulated — each ‘impinging’ while shying away from the other — seems to disclaim the depth that the motif wants to suggest. (In this regard, it is interesting to compare this canvas to a work which shares much of its visual DNA: <em>7.11.66</em>). Perspectival depth butts against the optical one generated by the red-against-green. Indeed, one finds that by abandoning depth, the visual balance of the composition returns. The effect is almost that of turning the colour planes around in one’s head, or folding and unfolding them, until one has found a comfortable viewing-point. This amounts — almost — to a cheap trick. It is in this play that one would truly be inclined to find what is sculptural about the work, to understand how it works with a distinctly spatial logic. A fascinating picture which demonstrates Hoyland’s readiness to move towards the bolder experiments of his mature practice, this canvas speaks to Hoyland’s erudite attempt to reconcile structure and sentiment in his personal abstract expressionist idiom.
"
./Images/t21.png,Zelah,Sculpture,SCR/Fellow's Corridor,Denis Mitchell,Modernism,1961,1960s,"The English Sculptor Denis Mitchell (1912-1993) worked as Barbara Hepworth’s principal assistant for ten years, between 1949-59. Mitchell’s undulating, totem-like <em>Zelah</em> — executed in 1961 and carved from elm, contains a certain restless energy. If Hepworth’s four-square balancing act in Churchill’s great court evokes, with an illusionist’s touch, a balance of fragility and solidity that majestically contains its energetic potential, her erstwhile assistant here charts the eruption of a vertical form out of energetic flux. Its material and organic form, too, invites the formation of connections between it and the natural landscape of Churchill College, a site where elm trees have been growing for hundreds of years."
./Images/t22.png,Tabard,Paintings,SCR/Fellow's Corridor,Albert Irvin,Abstraction,nil,nil,"Albert Irvin (1922-2015) was a prominent British abstract painter known for his vibrant and dynamic works. His later period of art is characterised by bold colours and energetic brushstrokes. Irvin's paintings are the result of the artistic collision of contextualising experiences, and translation of movement into space. <br> <br>

Irivin’s work is inspired by modern classical music — it follows a certain compositional logic with a freedom and energy brought to life through lively performance. These paintings are paragraphs described through a specific language. Their spatial organisation serves as an underlying rhythm, while Irvin’s love of complementary colours dominates the emotional range he sets for the paintings. <em>Tabard</em> suggests a riot of energy, particularly through the dominating bright yellows and oranges. Lively brushstrokes glide across the page, vying for attention as they lead the gaze from place to place across the large canvas. Although it initially appears chaotic, longer inspection gradually reveals the structure of the pictorial surface. Its different patches of colour are divided into nine spaces across the canvas. Left of the middle, a bright orange patch dominates the frame and compliments the red square located in the top right corner. However, the borders between these colour patches are not clearly defined and each bleeds out into the other. Seemingly carefree brushstrokes create lines that invade the borders, using movement to break through spaces and generate relationships. <br> <br>

'The painting is the outcome of the struggle to paint it,' Albert Irvin once said. As <em>Tabard</em> suggests, this struggle is a process of contextualising an experience of the world. Nonetheless, Irvin’s work should not be considered a representation of the world; Rather, like music, the painting itself is the world and experience. <em>Tabard</em> is filled with an immense passion and strength that radiates from the frame, influencing emotions and generating a bridge to the viewer through a unique language that touches the mind and heart. 
"
